Sheet: items → modules
A1: Item Name | B1: Item Description | C1: Item Model | D1: eur | E1: M001 | F1: M002 | G1: M003 | H1: M004 | I1: reichelt | J1: ifixit | K1: hellweg | L1: bauhaus | M1: heimwerkertools | N1: pine64 | O1: sonstiges | P1: segor | Q1: Auswahl | R1: Verpackung | S1: to buy | T1: link1 | U1: link2 | W1: M001 | X1: M002 | Y1: M003 | Z1: M004
A2: Headlamp | D2: of:=1.19*12.6 -> 14.994 | E2: 1 | I2: x | Q2: 🟨 | R2: 🟥 | T2: https://www.reichelt.de/de/de/shop/produkt/led-stirnleuchte_ip54_gestensteuerung-274890 | V2: ok, nicht optimal
D3: of:=1.19*8.4 -> 9.996 | I3: x | Q3: 🟨 | T3: https://www.reichelt.de/de/de/shop/produkt/led-stirnleuchte_240_lm_schwarz_ipx4_3x_aaa_micro_-329723 | V3: nicht optimal
B4: Xcell | D4: 9.24 | I4: x | T4: https://www.reichelt.de/de/de/shop/produkt/stirnleuchte_h280-365572
D5: 13.49 | K5: x | Q5: 🟥 | T5: https://www.hellweg.de/a/varta-led-kopfleuchte-outdoor-sports-h10-pro-inkl-batteriebestueckung-298060
A6: Travel Adaptor | B6: Netzteil USB | D6: 18.25 | E6: 1 | O6: x | Q6: 🟥 | T6: https://www.offgridtec.com/2-stk.-usb-ladegeraet-extra-flaches-netzteil-dual-port-usb-a-usb-c-weiss-30w.html
D7: 24.99 | N7: x | T7: https://pine64.com/product/pinepower-65w-gan-2c1a-charger-with-international-plugs/
D8: 4.55 | Q8: 🟨 | S8: x | T8: https://www.alibaba.com/product-detail/Universal-25W-QC-PD-Fast-Charging_1601334685806.html?spm=a2700.galleryofferlist.normal_offer.d_title.624513a0t6JrdA | V8: kommt er schnell genug?
A9: First Aid Kit | D9: 4.99 | E9: 1 | O9: x | Q9: ✅ | S9: x (5mal) | T9: https://www.docmorris.de/travellerset-32teilig-wundmed/16237371 | V9: Haben noch im Office – erstmal noch nicht kaufen ggf gleich 5x holen | W9: 1
D10: 9.99 | O10: x | T10: https://www.ebay.de/itm/223375996371
A11: Ointment for burns | D11: 7.49 | S11: x (1mal) | T11: https://www.docmorris.de/medice-brand-und-wundgel/03839625#queryID=2e3967ea7e01dcd56b7d54530a37fa61&position=1&objectID=LG8EDRVU_6fee4fe5-caf4-485d-9e1a-a3a5808ec912
A12: ✅ Scissors | D12: of:=13.28*1.19 -> 15.8032 | E12: 1 | I12: x | Q12: ✅ | T12: https://www.reichelt.de/de/de/shop/produkt/schere_secumax_363_sicherheitsschere_56_mm-289695 | W12: 1
D13: of:=1.19*6.29 -> 7.4851 | I13: x | Q13: 🟥 | T13: https://www.reichelt.de/de/de/shop/produkt/schere_allzweck_soft-cut_210_mm-309467 | V13: viel zu groß
A14: ballpoint pen | E14: 1
A15: Measure tape | D15: of:=1.19*4.45 -> 5.2955 | E15: 1 | I15: x | Q15: 🟥 | T15: https://www.reichelt.de/de/de/shop/produkt/massband_stahl_3_5_m-334634 | V15: eigtl zu groß, lieber was kleines finden
D16: 4.19 | I16: x | S16: Vielleich kaufen… | T16: https://www.reichelt.de/de/de/shop/produkt/massband_3_m-44266#closemodal
A17: Lighter | C17: BIC EZ Reach J38 | D17: 1-2€ | E17: 1 | V17: TODO kaufen – überlegen wo
B18: Sturmfeuerzeug von Bauhaus | Q18: 🟥
B19: Sturmfeuerzeug vom Späti | Q19: 🟨
A20: ✅ USB Flash drive | B20: 32-64GB | D20: of:=1.19*4.16 -> 4.9504 | E20: 1 | I20: x | Q20: 🟥 | T20: https://www.reichelt.de/de/de/shop/produkt/usb-stick_usb_3_2_gen1_32_gb_premium_line-150218
D21: of:=1.19*5 -> 5.95 | I21: x | Q21: 🟥 | T21: https://www.reichelt.de/de/de/shop/produkt/usb-stick_usb_3_0_16_gb_slim_line-150461
D22: of:=1.19*5.84 -> 6.9496 | I22: x | Q22: 🟥 | T22: https://www.reichelt.de/de/de/shop/produkt/usb-stick_usb_3_0_32_gb_usb-c_otg_dual_drive-237772
D23: of:=1.19*6.3 -> 7.497 | I23: x | Q23: 🟨 | T23: https://www.reichelt.de/de/de/shop/produkt/usb-stick_usb_3_0_64_gb_kombo_usb-c-305352
D24: of:=1.19*8.36 -> 9.9484 | I24: x | Q24: 🟨 | T24: https://www.reichelt.de/de/de/shop/produkt/usb-stick_usb_3_0_a_typ-c_64gb_ultra_dual_drivego-298215
D25: of:=1.19*10.04 -> 11.9476 | I25: x | Q25: ✅ | R25: 🟩 | T25: https://www.reichelt.de/de/de/shop/produkt/usb-stick_usb_3_2_32_gb_usb-c_usb-a-275413
A26: ✅ Soldering Iron | C26: Pinecil | D26: 25.99 | F26: 1 | N26: x | T26: https://pine64.com/product/pinecil-smart-mini-portable-soldering-iron/ | V26: USB oder Netzkabel?
B27: Cable 1,5m | D27: 3.99 | N27: x | T27: https://pine64.com/product/usb-type-c-to-usb-type-c-silicone-power-charging-cable-1-5-meter-length/
C28: KETS02 | D28: 85.99 | O28: x | Q28: 🟦 | T28: https://de.geekbuying.com/item/KAIWEETS-KETS02-Intelligentes-digitales-Loetkolben-Kit-10000579.html | U28: https://www.ebay.de/itm/296924876592
C29: ZD-708 | D29: of:=1.19*7.06 -> 8.4014 | I29: x | Q29: ✅ | T29: https://www.reichelt.de/de/de/shop/produkt/loetkolben_30_w_temperaturgeregelt-90924 | V29: 50W Kolben wurde geliefert
C30: LK 50 | D30: 19.5 | P30: x | Q30: 🟥 | T30: https://www.segor.de/#Q=LK50%252FTempcontrol&M=1
A31: Multimeter | B31: incl Kabel | D31: 17.8 | F31: 1 | P31: x | T31: https://www.segor.de/#Q=MS8233B&M=1
D32: of:=1.19*17.98 -> 21.3962 | I32: x | Q32: (✅) | R32: 🟥 | T32: https://www.reichelt.de/de/de/shop/produkt/truerms_digital-multimeter_2_000_counts_600_v_ncv-297580 | V32: gut, aber die upgrade version kaufen
D33: 33.5 | I33: x | T33: https://www.reichelt.de/de/de/shop/produkt/truerms_digital-multimeter_6_000_counts_600_v_ncv-297581 | V33: ↑vlt die Upgrade-Version hiervon holen?
D34: of:=1.19*18.49 -> 22.0031 | I34: x | Q34: 🟨 | T34: https://www.reichelt.de/de/de/shop/produkt/thorsman_digital_multimeter_ac_dc_300_v-341793#closemodal
A35: ✅ Solder wire | D35: 4.95 | F35: 1 | J35: x | Q35: ✅ | T35: https://www.ifixit.com/de-de/products/lead-free-solder
A36: ✅ solder remover (box) | D36: 9.95 | J36: x | Q36: ✅ | T36: https://www.ifixit.com/de-de/products/ifixit-soldering-tip-cleaner | V36: gut aber Deckel ist doof
A37: desoldering wick | D37: 4.95 | J37: x | Q37: 🟥 | T37: https://www.ifixit.com/de-de/products/ifixit-desoldering-wick | V37: wahrscheinlich nicht mit reinnehmen
A38: ✅ flux (Flussmittel) | D38: 4.95 | J38: x | Q38: ✅ | T38: https://www.ifixit.com/de-de/products/no-clean-flux | V38: klein aber ginge noch
A39: twin wire | P39: x | Q39: 🟦 | T39: Segor
A40: telescopic magnet tool | D40: 6.2 | G40: 1 | I40: x | T40: https://www.reichelt.de/de/de/shop/produkt/magnet-kombi-set_teleskopmagnet_teleskopspiegel_magnetschale-184628
A41: Magnet-Heber | D41: 8.9 | L41: x | Q41: 🟦 | R41: 🟨 | T41: https://www.bauhaus.info/spezialschraubwerkzeuge/matador-magnetheber/p/11115815
A42: (neu) brush | D42: 2.95 | G42: 1 | J42: x | Q42: 🟨 | T42: https://www.ifixit.com/de-de/products/detailing-eraser
D43: 5.99 | K43: x | T43: https://www.hellweg.de/a/pinsel-set-15-teilig-452512
D44: 1.59 | K44: x | T44: https://www.hellweg.de/a/vincent-universalpinsel-fsc-groesse-0-428998
D45: of:=1.19*4.54 -> 5.4026 | I45: x | Q45: 🟨 | T45: https://www.reichelt.de/de/de/shop/produkt/esd_reinigungspinsel_1_8_cm-292942 | V45: gut
B46: Pinsel von Bauhaus | Q46: 🟨
A47: (neu) ruler | D47: 1.95 | J47: x (nicht Auf lager) | T47: https://www.ifixit.com/de-de/products/ifixit-6-inch-metal-ruler
D48: 12.99 | K48: x | Q48: 🟦 | T48: https://www.hellweg.de/a/krone-knopfmass-100-mm-123731 | V48: Supplier 2 = Bauhaus (das hat so ein ähnliches)
D49: 4.9 | L49: x | Q49: 🟦 | T49: https://www.bauhaus.info/lineale/scala-massstab-inox/p/30830684
A50: (neu) magnet mat | D50: 19.95 | J50: x | Q50: 🟦 | T50: https://www.ifixit.com/de-de/products/magnetic-project-mat-b-stock | U50: https://www.ifixit.com/de-de/products/magnetic-project-mat | V50: gut, mal schauen ob sie ins Set passt
A51: ✅ Essential Electronics Toolkit (iFixit) | D51: 24.95 | G51: 1 | J51: x | Q51: ✅ | T51: https://www.ifixit.com/de-de/products/essential-electronics-toolkit-b-stock
A52: ✅ super glue | D52: of:=1.19*1.43 -> 1.7017 | G52: 1 | I52: x | L52: x | Q52: ✅ | R52: 🟩 | T52: https://www.reichelt.de/de/de/shop/produkt/sekundenkleber_10g_transp_mit_pinsel-293070 | U52: bauhaus | V52: wahrscheinlich diesen bevorzugen (Bauhaus hat ihn auch)
D53: of:=1.19*4.79 -> 5.7001 | I53: x | Q53: 🟨 | T53: https://www.reichelt.de/de/de/shop/produkt/pattex_sekundenkleber_matic_pst2c_3_g-288986#closemodal
D54: 4.99 | Q54: 🟨 | T54: https://www.bauhaus.info/sekundenkleber/uhu-blitzschnell-sekundenkleber/p/27733837 | V54: Supplier 2 für den Pattex
A55: ✅ adjustable wrench | D55: 24.86 | H55: 1 | M55: x | Q55: 🟥 | T55: https://www.heimwerkertools.com/werkzeug/schraubwerkzeuge/6786/hoegert-verstellschluessel-mit-kurzem-griff-140-mm | V55: zu teuer
D56: 10.99 | K56: x | Q56: 🟥 | T56: https://www.hellweg.de/a/krone-rollgabelschluessel-150-mm-kst-griff-123386
D57: 5.25 | L57: x | Q57: ✅ | T57: https://www.bauhaus.info/rollgabelschluessel/matador-rollgabelschluessel/p/25327890 | V57: gut
B58: Knipex Cobra 150 mm | D58: 24.8 | L58: x | Q58: 🟦
A59: ✅ cutter | D59: 4.95 | H59: 1 | J59: x | Q59: ✅ | T59: https://www.ifixit.com/de-de/products/precision-utility-knife | V59: OK, aber Kunststoff etc. wirkt nur semi-stabil. Passen normale Schneiden rein? Lieber einen Besseren
D60: 6.9 | L60: x | Q60: 🟨 | T60: https://www.bauhaus.info/cuttermesser/stanley-cuttermesser-interlock/p/11029561
A61: set of allen keys | D61: 5.97 | H61: 1 | M61: x | Q61: 🟥 | T61: https://www.heimwerkertools.com/werkzeug/schraubwerkzeuge/6944/hoegert-sechskantschluesselsatz-aus-s2-stahl-9-tlg
D62: 24.86 | M62: x | Q62: 🟥 | T62: https://www.heimwerkertools.com/werkzeug/schraubwerkzeuge/6936/hoegert-sechskantschluesselsatz-farbcodiert-9-tlg
D63: 8.65 | L63: x | Q63: 🟨 | T63: https://www.bauhaus.info/innensechskantschluessel-stiftschluessel/matador-stiftschluesselsatz/p/11115664 | V63: gut aber die Lasche zum Aufhängen nervt weil man sie abmachen müsste, und eigtl zu dick
B64: bei Stahlwerk gucken
A65: ✅ pointed pliers | D65: of:=1.19*15.12 -> 17.9928 | I65: x | Q65: ✅ | R65: 🟩 | T65: https://www.reichelt.de/de/de/shop/produkt/flachrundzange_radiozange_140_mm-115789 | V65: gut, wahrscheinlich die bessere (am besten sollten beide ins Board passen
D66: of:=1.19*3.49 -> 4.1531 | I66: x | Q66: 🟨 | R66: 🟨 | T66: https://www.reichelt.de/de/de/shop/produkt/spitzzange_130_mm-107280 | V66: gut
A68: ✅ wire clipper | D68: of:=1.19*6.55 -> 7.7945 | H68: 1 | I68: x | Q68: ✅ | T68: https://www.reichelt.de/de/de/shop/produkt/kabelcutter-183848 | V68: gut
P69: x | T69: Segor?
L70: x | Q70: ✅ | T70: https://www.bauhaus.info/pozidriv-schraubendreher/wisent-schraubendreher/p/30138698
A71: ✅ cross head screwdriver | D71: 7.31 | H71: 1 | M71: x | Q71: 🟥 | T71: https://www.heimwerkertools.com/werkzeug/schraubwerkzeuge/6915/hoegert-schraubendreher-satz-zum-arbeiten-unter-spannung-bis-1000v-2-tlg | V71: raus, zu klobig
A72: ✅ flat head screwdriver | H72: 1 | Q72: 🟥
L73: x | Q73: ✅ | T73: https://www.bauhaus.info/schlitz-schraubendreher/wisent-schraubendreher/p/30137686
A74: Wechsel-Schraubenzieher | D74: 3.95 | L74: x | Q74: 🟨 | T74: https://www.bauhaus.info/bithalter/matador-umsteckschraubendreher/p/30439841
C75: set 6-teilig | D75: 25.99 | K75: x | Q75: 🟥 | T75: https://www.hellweg.de/a/krone-schraubendreher-satz-holz-6-teilig-122932
A76: ✅ small flat hat screwdriver | B76: with power line tester | D76: 1.02 | H76: 1 | M76: x | Q76: 🟥 | T76: https://www.heimwerkertools.com/werkzeug/schraubwerkzeuge/6913/hoegert-spannungspruefer-100-250v-140-mm-flachklinge-3-mm-mit-leuchtanzeige
D77: 3.59 | K77: x | Q77: 🟥 | T77: https://www.hellweg.de/a/krone-spannungspruefer-vde-100-mm-122986 | V77: gut aber eigentlich wollen wir nicht Hellweg
D78: 3.28 | Q78: ✅ | T78: https://www.reichelt.de/de/de/shop/produkt/spannungspruefer_220-250_volt-320927 | U78: https://www.reichelt.de/de/de/shop/produkt/schraubendreher_phasenpruefer_schlitz_3_0_mm-22708
A79: Schneidematte | D79: of:=1.19*8.91 -> 10.6029 | I79: x | Q79: 🟥 | T79: https://www.reichelt.de/de/de/shop/produkt/schneidmatte_230_x_320_mm_selbstreparierend-289723
D80: of:=1.19*4.71 -> 5.6049 | I80: x | T80: https://www.reichelt.de/de/de/shop/produkt/schneidematte_a4_300_x_220_x_3_mm-380424
B81: Martor | Q81: 🟨 | T81: Bauhaus
A82: Magnetisierungstool | D82: 9.75 | I82: x | S82: x | T82: https://www.reichelt.de/de/de/shop/produkt/magnetisierer_entmagnetisierer_52_mm-28860
D83: 7.86 | I83: x | S83: x | T83: https://www.reichelt.de/de/de/shop/produkt/magnetisierer_entmagnetisierer-325201
A84: small piece of sandpaper | H84: 1
A85: Koffer | D85: 51.95 | O85: x | T85: https://xenotec-shop.de/produkt/max300/
A86: ———————
A87: Werkzeugtasche | B87: optional, zum Testen | D87: 39.95 | J87: (((x))) | T87: https://www.ifixit.com/de-de/products/ifixit-messenger-bag
A88: Polyimid-Klebeband | B88: zum Testen, ggf. für Klebemodul | D88: 9.95 | J88: x | Q88: 🟥 | T88: https://www.ifixit.com/de-de/products/polyimide-tape
A89: Tape | D89: 2.95 | Q89: 🟦 | T89: https://www.bauhaus.info/panzertape/tesa-extra-power-gewebeband-perfect/p/15387182
A90: Löt-Werkzeugset | B90: nur, wenn gesponsort wird | J90: (((x))) | T90: https://www.ifixit.com/de-de/products/fixhub-soldering-toolkit
A91: Multitool Kreditkartenformat | D91: of:=1.19*0.64 -> 0.7616 | I91: x | Q91: 🟦 | T91: https://www.reichelt.de/de/de/shop/produkt/multitool_11_in_1_kreditkarten-design_edelstahl-348482
A92: Keil-Hebel | B92: Matador Kulti-Keil | D92: 6.95 | L92: x | Q92: 🟦 | T92: https://www.bauhaus.info/kfz-werkzeuge/matador-multifunktionskeil/p/20269988
A94: Sturmfeuerzeug | D94: 3.95 | L94: x | Q94: 🟦 | T94: https://www.bauhaus.info/feuerzeuge/universalbrenner/p/25592388
I99: of:=COUNTA([.I2:.I98]) -> 29 | J99: of:=COUNTA([.J2:.J98]) -> 12 | K99: of:=COUNTA([.K2:.K98]) -> 7 | L99: of:=COUNTA([.L2:.L98]) -> 12 | M99: of:=COUNTA([.M2:.M98]) -> 5 | N99: of:=COUNTA([.N2:.N98]) -> 3 | O99: of:=COUNTA([.O2:.O98]) -> 5 | P99: of:=COUNTA([.P2:.P98]) -> 4
B104: billigste Variante: | D104: of:=[.D85]+[.D76]+[.D71]+[.D68]+[.D66]+[.D61]+[.D59]+[.D57]+[.D52]+[.D51]+[.D50]+[.D47]+[.D44]+[.D40]+[.D38]+[.D37]+[.D36]+[.D35]+[.D31]+[.D27]+[.D20]+[.D15]+[.D13]+[.D9]+[.D6]+[.D3] -> 242.2963 | T104: (plus ein bisschen Kleinkram)
B105: teuerste Variante: | D105: of:=[.D85]+[.D77]+[.D71]+[.D68]+[.D65]+[.D62]+[.D59]+[.D55]+[.D53]+[.D51]+[.D50]+[.D48]+[.D43]+[.D40]+[.D38]+[.D37]+[.D36]+[.D35]+[.D34]+[.D28]+[.D25]+[.D15]+[.D12]+[.D10]+[.D7]+[.D2] -> 434.9008 | T105: (plus ein bisschen Kleinkram)

Sheet: modules → kits
B1: Repair – Basic | C1: Radio | D1: Multimedia | E1: Bike
A2: M001 | B2: 1
A3: M002 | B3: 1 | C3: 1
A4: M003 | B4: 1
A5: M004
A6: M005 | C6: 1
A7: M006 | C7: 1
A8: M007 | D8: 1
A9: M008 | D9: 1
A10: M009 | D10: 1
A11: M010 | D11: 1

Sheet: Ausgaben Tracker
D1: davon Versand
B2: Bestellungen | C2: of:=SUM([.C4:.C12]) -> 603.55 | D2: of:=SUM([.D4:.D12]) -> 36.38 | F2: bestellt | G2: bezahlt | H2: unterwegs | I2: kam an | J2: ↗ Rechnung
B4: reichelt.de | C4: 220.27 | D4: 7.95 | F4: x | G4: x | H4: x | I4: x | J4: x
B5: iFixit | C5: 87.55 | D5: 0 | F5: x | G5: x | H5: x | I5: x | J5: x
B6: heimwerkertools | C6: 44.66 | D6: 5.5 | F6: x | G6: x | H6: x | I6: x | J6: x
B7: pine store | C7: 61.85 | D7: 11.08 | F7: x | G7: x | H7: x
B8: offgridtec | C8: 24.15 | D8: 5.9 | F8: x | G8: x | H8: x | I8: x | J8: x
B9: geekbuying | C9: 73.49 | D9: 0 | F9: x | G9: x | H9: x | I9: x | J9: x
B10: DocMorris | C10: 34.94 | D10: 0 | F10: x | G10: x | H10: x
B11: reichelt.de | C11: 56.64 | D11: 5.95 | F11: x | G11: x
F14: Geld zurück | G14: ↗ Beleg
B15: Einkäufe | C15: of:=SUM([.C17:.C23]) -> 0
B17: Hellweg
B18: Bauhaus
B19: Segor